{"$schema":"card_rules.schema.json","version":1,"cardType":"APPOINTMENT_CARD","triggers":{"keywords":["预约","就诊","挂号","提醒您","预约成功","到诊"],"senderPrefixes":[]},"fields":[{"name":"subject","required":true,"weight":0.4,"patterns":["(?:预约|挂号)([^，。；;]{2,30})","([^，。；;]{2,30})(?:预约成功|提醒您)"]},{"name":"dateTime","required":true,"weight":0.4,"patterns":["(\\d{1,2}[月/-]\\d{1,2}[日\\s]+\\d{1,2}:\\d{2})","(\\d{4}-\\d{1,2}-\\d{1,2}\\s+\\d{1,2}:\\d{2})"]},{"name":"location","required":false,"weight":0.1,"patterns":["(?:地点|地址|医院|科室)[：:]?\\s*([^，。；;]{2,40})"]},{"name":"contactPhone","required":false,"weight":0.1,"patterns":["(1[3-9]\\d{9}|0\\d{2,3}-?\\d{7,8})"]}]}
