{"$schema":"card_rules.schema.json","version":1,"cardType":"BANK_CARD","triggers":{"keywords":["消费","到账","转账","入账","扣款","余额","交易","还款"],"senderPrefixes":[]},"fields":[{"name":"amount","required":true,"weight":0.5,"patterns":["[￥¥]\\s*(\\d+(?:\\.\\d{1,2})?)","(\\d+(?:\\.\\d{1,2})?)元"]},{"name":"accountLast4","required":false,"weight":0.2,"patterns":["(?:尾号|账户)[^0-9]{0,4}(\\d{4})","(\\d{4})账户"]},{"name":"merchantName","required":false,"weight":0.2,"patterns":["于(.{2,30}?)消费","在(.{2,30}?)刷卡"]},{"name":"balance","required":false,"weight":0.1,"patterns":["余额[：:]?\\s*[￥¥]?(\\d+(?:\\.\\d{1,2})?)"]}]}
