{"$schema":"card_rules.schema.json","version":1,"cardType":"RECHARGE_CARD","triggers":{"keywords":["充值成功","话费","电费","水费","燃气","缴费"],"senderPrefixes":[]},"fields":[{"name":"serviceType","required":true,"weight":0.4,"patterns":["(话费|电费|水费|燃气费|燃气|缴费)"]},{"name":"amount","required":true,"weight":0.4,"patterns":["[￥¥]\\s*(\\d+(?:\\.\\d{1,2})?)","(\\d+(?:\\.\\d{1,2})?)元"]},{"name":"account","required":false,"weight":0.1,"patterns":["(?:账户|用户号|号码)[：:]?\\s*([0-9A-Z]{4,20})"]},{"name":"balance","required":false,"weight":0.1,"patterns":["余额[：:]?\\s*([^，。；;]{1,20})"]}]}
